{"handoff_packet":{"conclusions":["release notes for three tags prepared locally"],"key_evidence":["commit counts reconciled per range","all commits covered in notes"],"next_actions":["review the three files","decide whether to publish (needs approval)"],"risks":["notes based on commit messages alone may miss context"]},"permission_gates":["publishing notes to any external channel requires explicit user approval before the action"],"rollback":"delete the three new files; git history was only read","schema_version":"tool_use_handoff_output.v1","task_boundary":"Produce release notes for the three given tags from local history only; no external publication.","tool_plan":[{"expected_output":"commit list per range","failure_classification":"empty range: stop and report","input":"range between the three tags","step":"inspect history","tool":"git log","verification_evidence":"commit counts match tag differences"},{"expected_output":"three markdown files","failure_classification":"template missing: halt writes","input":"commit lists plus existing note template","step":"write notes","tool":"file editor","verification_evidence":"files parse as markdown and cover every listed commit"}],"verification_matrix":["step 1 verified by commit count reconciliation","step 2 verified by markdown parse and commit coverage check"]}